{
  "from_phase": "phase-4a",
  "to_phase": "phase-4b",
  "timestamp": "2025-03-15T13:00:00Z",
  "status": "complete",
  "notes": "User approved all 7 confirmations without changes.",
  "artifacts": {
    "phase-4a": {
      "design_spec_sections": [1, 2, 3, 4, 5, 6, 7, 8, 9, 10, 11],
      "style_personality": "executive",
      "canvas_size": { "width": 1664, "height": 936 },
      "theme_file": "StaticResources/RegisteredResources/sales-executive.json",
      "pages": [
        {
          "slug": "executive-summary",
          "layout_file": "exec-3-kpi-trend.json",
          "visuals": [
            { "name": "kpi-revenue", "chart_recipe": "kpi-card-single", "measures": ["Revenue"] },
            { "name": "kpi-margin", "chart_recipe": "kpi-card-single", "measures": ["Gross Margin %"] },
            { "name": "kpi-deals", "chart_recipe": "kpi-card-single", "measures": ["Deal Count"] },
            { "name": "revenue-trend", "chart_recipe": "line-trend-monthly", "measures": ["Revenue", "Revenue YoY %"], "columns": ["Date[Month]"] }
          ]
        },
        {
          "slug": "regional-analysis",
          "layout_file": "comparison-bar-map.json",
          "visuals": [
            { "name": "region-bar", "chart_recipe": "clustered-bar-horizontal", "measures": ["Revenue", "Gross Margin %"], "columns": ["Region[RegionName]"] },
            { "name": "region-map", "chart_recipe": "filled-map-gradient", "measures": ["Revenue"], "columns": ["Region[Country]"] }
          ]
        },
        {
          "slug": "product-mix",
          "layout_file": "breakdown-treemap-table.json",
          "visuals": [
            { "name": "category-treemap", "chart_recipe": "treemap-single-level", "measures": ["Revenue"], "columns": ["Product[Category]"] },
            { "name": "product-table", "chart_recipe": "matrix-expandable", "measures": ["Revenue", "Deal Count", "Avg Deal Size"], "columns": ["Product[Category]", "Product[SubCategory]"] }
          ]
        }
      ],
      "navigation_pattern": "page-navigator-left",
      "icon_set": "fluent-regular",
      "sign_off": {
        "user_reply": "proceed",
        "timestamp": "2025-03-15T12:55:00Z",
        "amended_items": []
      }
    }
  }
}
