{
  "from_phase": "phase-4b",
  "to_phase": "phase-5",
  "timestamp": "2025-03-15T14:30:00Z",
  "status": "complete",
  "notes": "All 3 pages generated and validated. No lint errors, 2 warnings acknowledged.",
  "artifacts": {
    "phase-4b": {
      "report_folder": "Sales Analysis Demo.Report/",
      "page_count": 3,
      "visual_count": 9,
      "navigation_type": "page-navigator-left",
      "has_mobile_layout": false,
      "has_drillthrough": false,
      "validation_passed": true,
      "polish_report": {
        "finalize_pbir_ok": true,
        "design_qa_errors": 0,
        "design_qa_warnings": 2,
        "acknowledged_warnings": [
          "executive-summary: page has 7 visuals (threshold 6 for executive style)",
          "product-mix: pie chart absent — treemap used instead (acceptable)"
        ]
      }
    }
  }
}
